<?xml version="1.0" encoding="UTF-8"?>
<izvestaj-o-imunizaciji
  xmlns:xsi="http://www.w3.org/2001/XMLSchema-instance"
  xsi:schemaLocation="http://euprava.org/izvestaj_o_imunizaciji ../xsd/izvestaj_o_imunizaciji.xsd"
  xmlns="http://euprava.org/izvestaj_o_imunizaciji"
  xmlns:os="http://osnovna-sema.org"
  izdato="11.09.2022"
  od="01.08.2021"
  do="01.09.2021"
>
  <statistika-zahteva>
    <podneto>2758</podneto>
    <primljeno>453</primljeno>
    <izdato>428</izdato>
  </statistika-zahteva>
  <statistika-doza>
    <ukupno-izdatih-doza>3225</ukupno-izdatih-doza>
    <izdate-doze>
      <doza redni-broj="1">1789</doza>
      <doza redni-broj="2">1276</doza>
      <doza redni-broj="3">160</doza>
    </izdate-doze>
  </statistika-doza>
  <statistika-proizvodjaca>
    <proizvodjac>
      <naziv>Pfizer, BioNTech</naziv>
      <broj-doza>1625</broj-doza>
    </proizvodjac>
    <proizvodjac>
      <naziv>Sinopharm</naziv>
      <broj-doza>1100</broj-doza>
    </proizvodjac>
    <proizvodjac>
      <naziv>Sputnik V</naziv>
      <broj-doza>356</broj-doza>
    </proizvodjac>
    <proizvodjac>
      <naziv>AstraZeneca, Oxford</naziv>
      <broj-doza>144</broj-doza>
    </proizvodjac>
  </statistika-proizvodjaca>
</izvestaj-o-imunizaciji>